{
  "layout": { "width": 700, "height": 400 },
  "nodes": {
    "ios":       { "x": 50,  "y": 50,  "size": "l" },
    "android":   { "x": 50,  "y": 200, "size": "l" },
    "api":       { "x": 300, "y": 125, "size": "l" },
    "push":      { "x": 300, "y": 280, "size": "s" },
    "storage":   { "x": 520, "y": 50,  "size": "m" },
    "database":  { "x": 520, "y": 180, "size": "m" }
  },
  "nodeData": {
    "ios":      { "icon": "Smartphone", "name": "iOS App",     "subtitle": "Swift",    "color": "violet" },
    "android":  { "icon": "Smartphone", "name": "Android App", "subtitle": "Kotlin",   "color": "emerald" },
    "api":      { "icon": "Server",     "name": "Backend API", "subtitle": "Node.js",  "color": "blue" },
    "push":     { "icon": "Bell",       "name": "Push Service","subtitle": "Firebase", "color": "amber" },
    "storage":  { "icon": "Cloud",      "name": "File Storage","subtitle": "S3",       "color": "sky" },
    "database": { "icon": "Database",   "name": "Database",    "subtitle": "MongoDB",  "color": "zinc" }
  },
  "connectors": [
    { "from": "ios",     "to": "api",      "fromAnchor": "right",  "toAnchor": "left", "style": "rest" },
    { "from": "android", "to": "api",      "fromAnchor": "right",  "toAnchor": "left", "style": "rest" },
    { "from": "api",     "to": "storage",  "fromAnchor": "right",  "toAnchor": "left", "style": "s3" },
    { "from": "api",     "to": "database", "fromAnchor": "right",  "toAnchor": "left", "style": "mongo" },
    { "from": "api",     "to": "push",     "fromAnchor": "bottom", "toAnchor": "top",  "style": "fcm" },
    { "from": "push",    "to": "ios",      "fromAnchor": "left",   "toAnchor": "bottom", "style": "push", "curve": "natural" },
    { "from": "push",    "to": "android",  "fromAnchor": "left",   "toAnchor": "bottom", "style": "push", "curve": "natural" }
  ],
  "connectorStyles": {
    "rest":  { "color": "blue",    "strokeWidth": 2, "label": "REST" },
    "s3":    { "color": "sky",     "strokeWidth": 2, "label": "S3" },
    "mongo": { "color": "zinc",    "strokeWidth": 2, "label": "MongoDB" },
    "fcm":   { "color": "amber",   "strokeWidth": 2, "label": "FCM" },
    "push":  { "color": "amber",   "strokeWidth": 1.5, "label": "push", "dashed": true }
  }
}
